[
  {
    "campaignResponses": [],
    "errorCode": 0,
    "id": "68962b6864fc7d6ff7266c1f",
    "persistedUserId": {
      "accountId": "",
      "entityId": "9LKbWKhjDzuG5_pexnvyJF1hHL1R27VIDPwEIS95Zhhwbiuo6VZuL_AYOxPcpHsiLYf2jNscZgq1qeKwDGrivNpCmQ5WuNeNIJ_ZSgEg9khDBdrJFODtxbh-s41887fA"
    },
    "resolvedUserId": "a0687fe6dd5da634a58c1988"
  },
  {
    "campaignResponses": [
      {
        "campaignId": "2fwcc",
        "campaignJavascriptContent": null,
        "campaignName": "Cart Confirm - Consented - Current",
        "campaignType": "ServerSide",
        "experienceId": "8GsXR",
        "experienceName": "Co-Buy + Similar Items",
        "experienceSourceCode": "",
        "payload": {
          "campaign": "2fwcc",
          "experience": "8GsXR",
          "fullProductIds": [
            "AN-45407437AD-000-015",
            "AN-100934744-000-015",
            "AN-4110972460095-000-015",
            "AN-98368624-000-015",
            "AN-4123957990005-000-015",
            "AN-100934777-000-015",
            "AN-93439776-000-015",
            "AN-4125972460005-000-015",
            "AN-4115912140003-000-015",
            "AN-95912424-000-015",
            "AN-98368608-000-015",
            "AN-4123652010053-000-015",
            "AN-96680376-000-015",
            "AN-4114556770051-000-015",
            "AN-4122971810001-000-015",
            "AN-4123957990008-000-015"
          ],
          "itemType": "Product",
          "maxRatingBound": 5,
          "maximumNumberOfProducts": 16,
          "placement": {
            "displayPriority": 1,
            "label": "Cart Confirm",
            "placement": "cartConfirm"
          },
          "recsConfig": {
            "itemType": "Product",
            "itemTypeIsRestricted": true,
            "maxResults": 16,
            "maxResultsIsRestricted": true,
            "onPageAnchorId": null,
            "onPageAnchorType": null,
            "recipe": {
              "id": "ToECf",
              "label": "PDP - Co-Buy + Similar Items"
            },
            "recipeId": null
          },
          "templateId": "staticRecTray",
          "userGroup": "Test"
        },
        "state": "Published",
        "templateNames": [
          "Static Rec Trays"
        ],
        "type": "ng",
        "userGroup": "Default"
      },
      {
        "campaignId": "pnF4F",
        "campaignJavascriptContent": null,
        "campaignName": "PDP Bottom - Co-Buy - Consented",
        "campaignType": "ServerSide",
        "experienceId": "SaBj3",
        "experienceName": "PDP Bottom - Co-Buy",
        "experienceSourceCode": "",
        "payload": {
          "campaign": "pnF4F",
          "experience": "SaBj3",
          "fullProductIds": [
            "AN-4130647160153-000-560",
            "AN-86767662-000-025",
            "AN-4114086690121-000-069",
            "AN-99758856-000-010",
            "AN-4130652010091-000-256",
            "AN-4130942140004-000-060",
            "AN-68798297-000-069",
            "AN-67685065-000-006",
            "AN-4130646420009-000-256",
            "AN-82903097-000-060"
          ],
          "itemType": "Product",
          "maxRatingBound": 5,
          "maximumNumberOfProducts": 10,
          "placement": {
            "displayPriority": 4,
            "label": "PDP: Bottom Tray",
            "placement": "pdpBottom"
          },
          "recsConfig": {
            "itemType": "Product",
            "itemTypeIsRestricted": true,
            "maxResults": 10,
            "maxResultsIsRestricted": true,
            "onPageAnchorId": null,
            "onPageAnchorType": null,
            "recipe": {
              "id": "QuPw1",
              "label": "Co-Buy Min Target 2 - IS Update 2"
            },
            "recipeId": null
          },
          "templateId": "staticRecTray",
          "userGroup": "Test"
        },
        "state": "Published",
        "templateNames": [
          "Static Rec Trays"
        ],
        "type": "ng",
        "userGroup": "Default"
      },
      {
        "campaignId": "vmcTE",
        "campaignJavascriptContent": null,
        "campaignName": "PDP Top - Consented - Current (Test)",
        "campaignType": "ServerSide",
        "experienceId": "3NPza",
        "experienceName": "Old Recipe",
        "experienceSourceCode": "",
        "payload": {
          "campaign": "vmcTE",
          "experience": "3NPza",
          "fullProductIds": [
            "AN-102520541-000-015",
            "AN-100892702-000-015",
            "AN-87389912-000-015",
            "AN-4114326950199-000-015",
            "AN-4114345140024-000-015",
            "AN-87570057-000-015",
            "AN-93752004-000-015",
            "AN-100908441-000-015",
            "AN-102374501-000-014",
            "AN-95925392-000-015",
            "AN-98054018-000-015",
            "AN-4139880890360-000-015",
            "AN-92699461-000-015",
            "AN-102374097-000-011",
            "AN-98563471-000-015",
            "AN-88303763-000-015"
          ],
          "itemType": "Product",
          "maxRatingBound": 5,
          "maximumNumberOfProducts": 16,
          "placement": {
            "displayPriority": 3,
            "label": "PDP: Top Tray",
            "placement": "pdpTop"
          },
          "recsConfig": {
            "itemType": "Product",
            "itemTypeIsRestricted": true,
            "maxResults": 16,
            "maxResultsIsRestricted": true,
            "onPageAnchorId": null,
            "onPageAnchorType": null,
            "recipe": {
              "id": "2jCHh",
              "label": "PDP Top - Co-Browse + Collab Filtering - category + color boost"
            },
            "recipeId": null
          },
          "templateId": "staticRecTray",
          "userGroup": "Test"
        },
        "state": "Published",
        "templateNames": [
          "Static Rec Trays"
        ],
        "type": "ng",
        "userGroup": "Default"
      }
    ],
    "errorCode": 0,
    "id": "68962ba7cc14ec02f94b9611",
    "persistedUserId": {
      "accountId": "",
      "entityId": "K4rsytVtReJ656phKFSWWFxedGzz40JnjTCMMTuwljcRX_mf3qt0gGHRKSr90BV2ZGB6oKHZVrTDPuRUgokegEh_1k4vPZoSz5-i0EbLpwdzXwBxfEQDnKRh4BQo5_D4"
    },
    "resolvedUserId": "a0687fe6dd5da634a58c1988"
  },
  {
    "campaignResponses": [
      {
        "campaignId": "KwZ6W",
        "campaignJavascriptContent": null,
        "campaignName": "Cart (AN Web) - Items Under $25 - Consented",
        "campaignType": "ServerSide",
        "experienceId": "3oIHf",
        "experienceName": "Our Favorites Under $25 (AN) - Consented",
        "experienceSourceCode": "",
        "payload": {
          "campaign": "KwZ6W",
          "experience": "3oIHf",
          "fullProductIds": [
            "AN-87664579-000-066",
            "AN-100610815-000-040",
            "AN-93260057-000-048",
            "AN-46288486-000-266",
            "AN-100177963-000-030",
            "AN-96994488-000-053",
            "AN-101955136-000-072",
            "AN-92032606-000-040",
            "AN-100808955-000-054",
            "AN-100679372-000-639",
            "AN-64001910-000-010",
            "AN-95908463-000-066",
            "AN-88447594-000-066",
            "AN-87245361-000-040",
            "AN-90789066-000-263",
            "AN-103250197-000-066"
          ],
          "itemType": "Product",
          "maxRatingBound": 5,
          "maximumNumberOfProducts": 16,
          "placement": {
            "displayPriority": 1,
            "label": "Cart",
            "placement": "cart"
          },
          "recsConfig": {
            "itemType": "Product",
            "itemTypeIsRestricted": true,
            "maxResults": 16,
            "maxResultsIsRestricted": true,
            "onPageAnchorId": null,
            "onPageAnchorType": null,
            "recipe": {
              "id": "Durrp",
              "label": "Items Under $25"
            },
            "recipeId": null
          },
          "templateId": "staticRecTray",
          "userGroup": "Test"
        },
        "state": "Published",
        "templateNames": [
          "Static Rec Trays"
        ],
        "type": "ng",
        "userGroup": "Default"
      }
    ],
    "errorCode": 0,
    "id": "68962be55835961fab82aa80",
    "persistedUserId": {
      "accountId": "",
      "entityId": "xqhcdPhLt3oHBCpY9_-qG3jt49LhFYNoZ3K45BzHLcAJhquyq7ozKuBkzR1k2wyCY83VmD8PyH4QMhccCXLpN-P7OVdW14s5x6CyPpH0UAYhaPdIR8R30rdeVxEROAX4"
    },
    "resolvedUserId": "a0687fe6dd5da634a58c1988"
  },
  {
    "campaignResponses": [
      {
        "campaignId": "mkyxD",
        "campaignJavascriptContent": null,
        "campaignName": "Homepage Tray 2 - Trending (Most Viewed) - Consented",
        "campaignType": "ServerSide",
        "experienceId": "qsau4",
        "experienceName": "Homepage Tray 2 - Trending (Most Viewed) - Consented",
        "experienceSourceCode": "",
        "payload": {
          "campaign": "mkyxD",
          "displayPriority": 3,
          "dynamicPlacement": "hpg-tray-2",
          "experience": "qsau4",
          "fullProductIds": [
            "AN-4130647160153-000-560",
            "AN-86767662-000-025",
            "AN-4114086690121-000-069",
            "AN-99758856-000-010",
            "AN-4130652010091-000-256",
            "AN-68798297-000-069",
            "AN-4130942140004-000-060",
            "AN-67685065-000-006",
            "AN-4130646420009-000-256",
            "AN-82903097-000-060"
          ],
          "maxRatingBound": 5,
          "maximumNumberOfProducts": 10,
          "placement": {
            "displayPriority": 3,
            "placement": "hpg-tray-2"
          },
          "recsConfig": {
            "itemType": "Product",
            "itemTypeIsRestricted": true,
            "maxResults": 10,
            "maxResultsIsRestricted": true,
            "onPageAnchorId": null,
            "onPageAnchorType": null,
            "recipe": {